doc_id,question
a5825c73,How can I make an account on your website?
a5825c73,What steps do I need to follow to register for an account?
a5825c73,Where is the 'Sign Up' button located on your website?
a5825c73,Can you guide me through the account creation process?
a5825c73,How do I complete the registration on your site?
db025979,What are your accepted payment methods for online orders?
db025979,Can I pay using a credit card on your website?
db025979,Do you accept debit card payments?
db025979,Is PayPal an option for online purchases?
db025979,What kinds of credit cards are accepted for online orders?
f936d8f6,How can I check the status of my order?
f936d8f6,Where can I find the tracking information for my shipment?
f936d8f6,Is there a way to monitor my order's progress online?
f936d8f6,How do I access my order history?
f936d8f6,Can I track my order through your website?
ae7b5c39,What is your policy for returning products?
ae7b5c39,Can I get a full refund if I return a product?
ae7b5c39,How many days do I have to return a product?
ae7b5c39,Should the product be in its original condition and packaging for a return?
ae7b5c39,Where can I find detailed instructions for returns?
0ea444c1,Can I cancel my order if it's already been shipped?
0ea444c1,How do I cancel my order if it hasn't been shipped yet?
0ea444c1,Do I need to contact customer support to cancel my order?
0ea444c1,What details do I need to provide to cancel my order?
0ea444c1,Who will assist me with the cancellation process?
12291f94,What are the shipping times for standard shipping?
12291f94,How long does express shipping take?
12291f94,Is shipping time affected by the destination?
12291f94,Can I choose my shipping method?
12291f94,Will my order arrive within the week if I choose express shipping?
44c67340,Do you ship internationally?
44c67340,Which countries do you ship to?
44c67340,How are international shipping costs calculated?
44c67340,Will I see the shipping costs during the checkout process?
44c67340,Is the availability of international shipping based on my location?
85d423f3,How much does shipping cost within the EU?
85d423f3,What is the shipping cost to countries outside the EU but within Europe?
85d423f3,What are the shipping costs to the US and Canada?
85d423f3,What is the shipping cost to other countries worldwide?
85d423f3,Are there any free shipping options available?
4d6e804e,What steps should I take if my package arrives damaged?
4d6e804e,Who should I contact if my delivery is lost during shipping?
4d6e804e,How does the shop handle issues with lost or damaged packages?
4d6e804e,What is the procedure if my order is damaged upon arrival?
4d6e804e,Whom should I inform if my package doesn't arrive?
a5f8ed75,Can I update my shipping address if I've already placed an order?
a5f8ed75,How do I change my shipping address after I've ordered?
a5f8ed75,Is it possible to modify my shipping address after placing an order?
a5f8ed75,What should I do if I need to change my shipping address after ordering?
a5f8ed75,Can the shipping address be altered once I've placed an order?
1556f9f4,What are the ways to reach customer support?
1556f9f4,What is the phone number for customer support?
1556f9f4,Where can I send an email for support?
1556f9f4,What are the operating hours for the customer support team?
1556f9f4,Can I get help outside of the provided hours?
e857f3fb,Do you provide gift wrapping services?
e857f3fb,Is there an additional cost for gift wrapping?
e857f3fb,Can I request gift wrapping during the checkout process?
e857f3fb,How do I add gift wrapping to my order?
e857f3fb,Is gift wrapping available for all items?
cbbe261f,Can you tell me about your price matching policy?
cbbe261f,What happens if I find a product cheaper elsewhere?
cbbe261f,How do I go about requesting a price match?
cbbe261f,Will you match prices for products found in physical stores?
cbbe261f,Do I need to provide any specific details when requesting a price match?
c47b55e8,Can I place an order by calling your customer service?
c47b55e8,Do you take phone orders?
c47b55e8,Is it possible to order items over the phone?
c47b55e8,Can I make a purchase by speaking to someone on the phone?
c47b55e8,Do you accept orders through phone calls?
4d10fe0f,How are my personal details protected during purchase?
4d10fe0f,What measures do you take to secure my payment information?
4d10fe0f,Can you assure me that my data is safe on your website?
4d10fe0f,Do you use any encryption methods to safeguard customer information?
4d10fe0f,What kind of security protocols do you follow for transactions?
1438fc3b,Can I get a price adjustment if I bought a product and it goes on sale within a week?
1438fc3b,How long after my purchase can I request a price adjustment if the item goes on sale?
1438fc3b,Is there a limit to how many times I can request a price adjustment?
1438fc3b,Who should I contact to request a price adjustment?
1438fc3b,What details do I need to provide to request a price adjustment?
bffba313,Do you have a loyalty program?
bffba313,How does your loyalty program work?
bffba313,Can I earn points with every purchase?
bffba313,What can I use the points for?
bffba313,How do I join the loyalty program?
716a4e4d,Can I order without having to create an account?
716a4e4d,"If I order as a guest, will I still be able to track my order?"
716a4e4d,What benefits do I get if I create an account?
716a4e4d,Can I make future purchases more easily if I have an account?
716a4e4d,Is it necessary to create an account to place an order?
4fceba91,Do you provide discounts for bulk orders?
4fceba91,Are there any wholesale discounts available?
4fceba91,How can I find out more about your bulk discounts?
4fceba91,Can you tell me which products are eligible for bulk discounts?
4fceba91,Who should I contact to discuss my specific bulk order requirements?
39134f05,Can I modify my order to remove an item?
39134f05,Is it possible to cancel a specific item from my order?
39134f05,What should I do if I change my mind about an item in my order?
39134f05,Can I contact someone if I need to replace an item in my order?
39134f05,How do I go about canceling an item from my current order?
3c130110,How can I provide feedback on a product I purchased?
3c130110,Where can I find the option to write a review for a product?
3c130110,How do I share my experience with a product on your website?
3c130110,What steps should I follow to leave a review for a product?
3c130110,Where is the 'Write a Review' button located on a product page?
5a7a6071,Can I use more than one promo code for a single purchase?
5a7a6071,Is it possible to apply multiple discount codes to one order?
5a7a6071,Can I combine several promo codes on a single transaction?
5a7a6071,"If I have multiple promo codes, can I use them all on one order?"
5a7a6071,Do you allow the use of more than one discount code per order?
d040fd2f,What is the procedure if I get the wrong item in my order?
d040fd2f,How do I handle it if my order contains the incorrect item?
d040fd2f,What steps should I take if I receive the wrong product?
d040fd2f,Who should I contact if the item I received is not what I ordered?
d040fd2f,What help can I expect from your team if I receive an incorrect item?
9d3f4396,Do you offer expedited shipping options for faster delivery?
9d3f4396,Can I select an expedited shipping method during checkout?
9d3f4396,Is expedited shipping available for all orders?
9d3f4396,What are the expedited shipping options you offer?
9d3f4396,How much does expedited shipping cost?
e3e525b5,Can I pre-order an item that is currently out of stock?
e3e525b5,How will I know when an out-of-stock product becomes available again?
e3e525b5,Is there a way to be notified about the restocking of a product?
e3e525b5,Can I receive an alert for a sold-out item?
e3e525b5,What happens if I try to order a product that is not in stock?
1f2fceb7,What information does your email newsletter cover?
1f2fceb7,How do I stay updated about new products?
1f2fceb7,Do you offer exclusive deals for newsletter subscribers?
1f2fceb7,Can I get tips for using your products through your newsletter?
1f2fceb7,Where can I sign up for your newsletter?
9a9ab0e5,Can I return a product if I decide I no longer want it?
9a9ab0e5,What are the conditions for returning a product in its original state?
9a9ab0e5,Is it possible to return a product if my mind changes about the purchase?
9a9ab0e5,What should I do if I want to return a product I bought from your shop?
9a9ab0e5,Are there any specific steps to follow when returning a product that I changed my mind about?
c4a9265b,Do you provide live assistance while I'm shopping on your website?
c4a9265b,Are there specific hours when I can access live chat support?
c4a9265b,How can I start a live chat with your support team?
c4a9265b,Is the live chat support available throughout the day?
c4a9265b,Where can I find the live chat option on your website?
01558321,Can I order an item as a gift and have it sent directly to the recipient?
01558321,Is it possible to ship a gift order directly to the recipient's address?
01558321,Can I enter the recipient's shipping address during the checkout process for a gift order?
01558321,Will you ship a product to a different address if I order it as a gift?
01558321,Can the recipient receive the gift order directly at their address?
5011e6e1,What steps can I take if my discount code isn't applying?
5011e6e1,How can I ensure my discount code is valid?
5011e6e1,What should I do if there's an issue with my discount code?
5011e6e1,Why isn't my discount code working?
5011e6e1,Who can help me if my discount code isn't functioning?
0dbcea26,Can I return a product that was marked as final sale?
0dbcea26,Are final sale items returnable or refundable?
0dbcea26,How do I know if a product is eligible for return if it was a final sale item?
0dbcea26,Who should I contact to confirm if a specific item can be returned even though it was a final sale?
0dbcea26,Where can I find information about the return eligibility of a final sale item?
0d948b46,Do you provide installation services for all your products?
0d948b46,How can I check if a product comes with installation services?
0d948b46,Can I request installation services when I purchase a product?
0d948b46,Who should I contact to inquire about installation services for a specific product?
0d948b46,Are there any additional fees for installation services?
0fc36df6,Can I purchase a product that is no longer in stock?
0fc36df6,Is it possible to buy items that have been discontinued?
0fc36df6,Are discontinued products available for ordering?
0fc36df6,Can I place an order for a product that is no longer manufactured?
0fc36df6,What should I do if I want to buy a product that is no longer available?
868edd01,Can I return a product without a receipt?
868edd01,What do I need to return a product?
868edd01,Is a receipt necessary for returns?
868edd01,Can I get assistance if I don't have a receipt for a return?
868edd01,Where can I find the return policy for your shop?
e90a28db,Can I have a product shipped to another country?
e90a28db,Do you provide international delivery?
e90a28db,Is it possible to order a product for delivery to a different country?
e90a28db,Can I get a product shipped internationally?
e90a28db,Which countries do you ship to internationally?
b5f9b9d1,Can I include a personalized note with my purchase?
b5f9b9d1,Is there an option to write a gift message during checkout?
b5f9b9d1,Can I add a custom message to my order?
b5f9b9d1,Is there a section to enter a gift message at checkout?
b5f9b9d1,Can I leave a special message for the recipient when I place my order?
231bdc75,Do you offer product demonstrations before purchase?
231bdc75,Is it possible to see a product in action before buying?
231bdc75,Can I have a live demonstration of the product before making a decision?
231bdc75,Do you provide any way to see how the product works before purchasing?
231bdc75,Is there an option to watch the product in use before I buy it?
53415902,Can I purchase a product that is currently listed as 'coming soon'?
53415902,Is it possible to buy a 'coming soon' product immediately?
53415902,Can I order an item that is marked as 'coming soon'?
53415902,Is there a way to acquire a product that is not yet available?
53415902,Can I receive notifications for when a 'coming soon' product becomes available?
f26b624d,Can I receive an invoice with my order?
f26b624d,Is an invoice included with my purchase?
f26b624d,Will I get an invoice for my order?
f26b624d,Do I need to request an invoice for my order?
f26b624d,Can I get a separate invoice for my order?
4194a7f7,Can I still order a 'limited edition' item if it's showing as available on your website?
4194a7f7,How do I know if a 'limited edition' product is still available for purchase?
4194a7f7,Is there a waitlist for 'limited edition' items if they are out of stock?
4194a7f7,Will 'limited edition' products be restocked once they sell out?
4194a7f7,What happens if I place an order for a 'limited edition' item and it becomes unavailable after my purchase?
d1379f24,Can I return a product if it's not in the original packaging?
d1379f24,Is the original packaging necessary for a return?
d1379f24,What should I do if I no longer have the original packaging for a return?
d1379f24,Can I still return a product without the original packaging?
d1379f24,Who should I contact for help with a return if I don't have the original packaging?
2d52c148,Can I reserve a product that is currently out of stock?
2d52c148,What happens if I want a product that is out of stock?
2d52c148,Is it possible to put an out-of-stock item on hold?
2d52c148,How can I be notified when an out-of-stock product is back in stock?
2d52c148,Do you offer reservations for items that are currently unavailable?
b874d464,Can I combine a pre-order item with items that are currently in stock in my order?
b874d464,Will my order containing both pre-order and in-stock items be shipped all at once?
b874d464,Is it possible to purchase a pre-order item along with regular stock items?
b874d464,What happens when I order both pre-order and in-stock products together?
b874d464,"Will my entire order, including both pre-order and in-stock items, be shipped at the same time?"
9a969d05,Can I return a product if it arrives damaged?
9a969d05,What should I do if my item is broken when it arrives?
9a969d05,Is there a process for returning a product damaged in transit?
9a969d05,Who should I contact if my product is damaged during shipping?
9a969d05,How do I get a replacement for a damaged item received?
56901444,Can you alert me when a product I'm interested in is back in stock?
56901444,How do I know when a sold-out item will be restocked?
56901444,Is there a way to be notified about the availability of popular products?
56901444,Can I request that a product be restocked if it's currently out of stock?
56901444,How can I ensure I'm informed when a product I want is available again?
057cdc80,Can I place an order for a product that shows as 'backordered'?
057cdc80,What does 'backordered' mean on your website?
057cdc80,"If a product is 'backordered', when will it be available again?"
057cdc80,Can I still order a 'backordered' item?
057cdc80,Will my order for a 'backordered' item be shipped immediately?
e9eae9be,Can I return a product if it was purchased during a sale?
e9eae9be,What happens if I want to return a product that was bought with a discount?
e9eae9be,Is the refund amount based on the original price or the discounted price if I return a sale item?
e9eae9be,Can sale items be returned for a full refund?
e9eae9be,How does the return process work for discounted items?
83e26d61,Can I have a product repaired or replaced if it arrives damaged?
83e26d61,What should I do if my product is damaged upon arrival?
83e26d61,How can I initiate a repair or replacement for a damaged product?
83e26d61,Who should I contact if I receive a damaged item?
83e26d61,What is the process for handling a damaged product?
8f1cfa7e,Can I order a product that is listed as 'out of stock' but shown as available for pre-order?
8f1cfa7e,"If I see a product marked 'out of stock' but with a 'pre-order' option, can I still place an order?"
8f1cfa7e,Is it possible to secure a product that is listed as 'out of stock' if it has a 'pre-order' option?
8f1cfa7e,"When a product is 'out of stock' but available for pre-order, can I make a purchase?"
8f1cfa7e,"If a product is 'out of stock' but has a 'pre-order' option, will my order be fulfilled once it's back in stock?"
0ee720eb,Can I return a product if it was purchased as a gift?
0ee720eb,"If I bought a product as a gift, can the recipient return it?"
0ee720eb,Will the refund for a returned gift be issued to the recipient's payment method?
0ee720eb,How are refunds handled for gifts that are returned?
0ee720eb,Can the original payment method be used for refunds of returned gifts?
953918bc,Can I still purchase a product if it's marked as 'discontinued'?
953918bc,"If a product is 'discontinued,' can I special order it?"
953918bc,Are 'discontinued' products available for sale?
953918bc,Can I request a discontinued item?
953918bc,Is it possible to buy a product that's listed as 'discontinued'?
dfc4f878,Can I purchase a product that is marked as 'sold out'?
dfc4f878,What happens when a product is listed as 'sold out'?
dfc4f878,"If a product is 'sold out,' can I still order it?"
dfc4f878,What does 'sold out' mean for product availability?
dfc4f878,Can I be notified when a 'sold out' product is back in stock?
193e71e9,Can I return a product bought with a gift card?
193e71e9,Will I get a refund if I return a product purchased with a gift card?
193e71e9,What form will the refund take if I return a product bought with a gift card?
193e71e9,Can the refund for a gift card purchase be in store credit?
193e71e9,Will I receive a new gift card if I return a product bought with one?
366c9e40,Can you notify me when a product becomes available in my size?
366c9e40,What happens if a product is not available in my size?
366c9e40,Is it possible to order a product that is currently out of stock?
366c9e40,How can I find out when a product will be restocked in my size?
366c9e40,What should I do if I see a product I like but it's not available in my size?
cfdd3b13,Can I buy a product that is listed as 'coming soon' but is available for pre-order?
cfdd3b13,"If I see a product marked as 'coming soon', can I still order it if it's available for pre-order?"
cfdd3b13,Is it possible to secure an item that is listed as 'coming soon' if it is available for pre-order?
cfdd3b13,Can I order a product that is 'coming soon' but has a pre-order option?
cfdd3b13,"If a product is 'coming soon' but available for pre-order, can I place an order for it?"
24ecf6bc,Can I return a product if I used a discount code during purchase?
24ecf6bc,Is returning a product possible even if it was bought with a discount?
24ecf6bc,What happens if I want to return a product that was purchased with a discount code?
24ecf6bc,Can items bought using a discount code be returned for a refund?
24ecf6bc,"If I bought a product with a discount, can I still return it?"
9a8437cb,Can you make a custom order for me?
9a8437cb,Is it possible to personalize any of your products?
9a8437cb,Do you offer customization services?
9a8437cb,Can I request a personalized item?
9a8437cb,Is there an option for custom orders on your website?
429d0ca5,Can I place an order for a product that is currently marked as 'temporarily unavailable'?
429d0ca5,What does 'temporarily unavailable' mean for a product on your website?
429d0ca5,"If a product is listed as 'temporarily unavailable,' can I still purchase it?"
429d0ca5,Will products listed as 'temporarily unavailable' be restocked in the future?
429d0ca5,Is there a way to be notified when a 'temporarily unavailable' product comes back in stock?
2caeef0d,What happens if I damage a product due to improper use?
2caeef0d,Can I return a product that I damaged by not using it correctly?
2caeef0d,Is damage from improper use covered by your return policy?
2caeef0d,"If a product is damaged due to my misuse, can I still return it?"
2caeef0d,What is your policy on returning products that were damaged because of how I used them?
b81d6268,Can I request a product that is listed as 'coming soon' but not available for pre-order?
b81d6268,What happens if a product is listed as 'coming soon' but cannot be pre-ordered?
b81d6268,"If a product is 'coming soon' but not available for pre-order, can I still buy it?"
b81d6268,What should I do if I want a product that is 'coming soon' but not available for pre-order?
b81d6268,Is there a way to purchase a product that is 'coming soon' but not available for pre-order?
8ee76407,Can I buy a product that is currently listed as 'on hold'?
8ee76407,What does 'on hold' mean for a product in your shop?
8ee76407,"If a product is 'on hold,' can I still order it?"
8ee76407,Will I receive notifications when a product listed as 'on hold' becomes available?
8ee76407,How can I find out when a product that is 'on hold' will be available for purchase again?
e16e43e1,What happens if I want to return a product but have lost the original receipt?
e16e43e1,Is it possible to return an item without the original receipt?
e16e43e1,Can I still make a return if I no longer have the purchase receipt?
e16e43e1,How can you assist with returns if I don't have the original receipt?
e16e43e1,Who should I contact for help with a return if I've lost the receipt?
4918376e,Can I ask for a 'limited edition' item to be restocked after it sells out?
4918376e,Will limited edition products be available again after they sell out?
4918376e,Is it possible to get more of a 'limited edition' product once it's gone?
4918376e,Can you restock 'limited edition' items once they're sold out?
4918376e,Will a sold-out 'limited edition' product become available again?
0ba74d77,Can I order a product if it's listed as 'discontinued' but still visible on your website?
0ba74d77,What should I do if I see a 'discontinued' product on your website?
0ba74d77,Is it possible to order a 'discontinued' product from your website?
0ba74d77,Why are 'discontinued' products still visible on your website?
0ba74d77,What happens if I try to order a 'discontinued' product from your website?
c618b995,Can I return a product if it was labeled as clearance or final sale?
c618b995,Are clearance or final sale items returnable?
c618b995,What is your policy on returning clearance or final sale items?
c618b995,"If I buy a final sale item, can I get a refund?"
c618b995,Can I return an item if it was part of your clearance or final sale event?
7f8d3c70,Can you order a product that isn't on your website?
7f8d3c70,What should I do if I can't find the product I want on your site?
7f8d3c70,Is it possible to request an item that's not listed?
7f8d3c70,How can I get help finding a product not on your website?
7f8d3c70,What happens if a product I'm looking for isn't available on your site?
508156be,Can I buy a product that is listed as 'out of stock' but available for backorder?
508156be,What happens if I order a product that is listed as 'out of stock' but available for backorder?
508156be,"If a product is 'out of stock' but can be backordered, can I still place an order?"
508156be,How do I secure a product that is listed as 'out of stock' but available for backorder?
508156be,Will a product listed as 'out of stock' but available for backorder be shipped immediately if I order it?
8ec93590,Can I return a product that was part of a bundle I bought?
8ec93590,"If I purchased a set, can I still return an item from it?"
8ec93590,What is the return policy for bundled products?
8ec93590,How do I return an item from a set I bought?
8ec93590,Who should I contact for return guidance on a bundle?
4629871f,Is it possible to request a restock for an 'out of stock' product?
4629871f,Do you usually restock popular products?
4629871f,Can I be notified when an 'out of stock' item is back in stock?
4629871f,How can I sign up to be alerted when an item becomes available again?
4629871f,What happens if I sign up for product notifications?
37e0fb9f,Can I buy a product that says 'coming soon'?
37e0fb9f,What does 'available for pre-order' mean?
37e0fb9f,Can I secure an item before it's available?
37e0fb9f,"If I order a 'coming soon' product, will it be reserved for me?"
37e0fb9f,What happens if I order a product that's listed as 'coming soon'?
d5c9a54b,Can I return a product if it was damaged during shipping?
d5c9a54b,What should I do if my product arrives damaged due to mishandling during transit?
d5c9a54b,Is there a process for returning products damaged during shipping?
d5c9a54b,How can I get help if my item was damaged in transit?
d5c9a54b,Who do I contact if my product was damaged due to shipping issues?
343491fb,Can I reserve an 'out of stock' product for later purchase?
343491fb,Is it possible to hold an item that is currently unavailable?
343491fb,Can I put an out-of-stock item on reserve?
343491fb,Will you notify me when an out-of-stock product is back in stock?
343491fb,Can I be alerted when a product that's currently unavailable becomes available again?
f3aa375f,Can I reserve a product that is available for backorder but listed as 'pre-order'?
f3aa375f,"If I order a 'pre-order' item that's available for backorder, when will it be shipped?"
f3aa375f,Will I be able to buy a 'pre-order' product if it's available for backorder?
f3aa375f,What happens if I order a product that is listed as 'pre-order' but available for backorder?
f3aa375f,Can I place an order for a 'pre-order' item if it's available for backorder?
a33fc747,Can I return a product if I bought it using store credit?
a33fc747,What happens if I want to return a product that was purchased with store credit?
a33fc747,Is it possible to get a refund for a product bought with store credit?
