doc_id,question
a33fc747,How are returns handled for products purchased using store credit?
a33fc747,"If I return a product bought with store credit, how will I receive my refund?"
945d2c30,Can I be notified when a product I'm interested in comes back in stock?
945d2c30,How do I know if a product will be restocked?
945d2c30,Is it possible to reserve a product that's currently out of stock?
945d2c30,What happens if a product I want is not available in the shop?
945d2c30,Can you inform me when a popular product is restocked?
eb52e704,Can I purchase a product that is currently sold out but has the option for pre-order?
eb52e704,Is it possible to order a product that is shown as sold out but has a pre-order option available?
eb52e704,"When a product is listed as sold out, can I still order it if it says it's available for pre-order?"
eb52e704,"If a product is sold out but can be pre-ordered, can I place an order for it now?"
eb52e704,Can I secure a product for purchase if it is sold out but has a pre-order option?
8cb3fec8,Can I return a product that I bought with a promotional gift card?
8cb3fec8,"If I return a product bought with a promotional gift card, what form will the refund take?"
8cb3fec8,Is it possible to get a cash refund for a product bought with a promotional gift card?
8cb3fec8,What happens to the value of the promotional gift card when I return a product?
8cb3fec8,Will I receive store credit or a new gift card if I return a product bought with a promotional gift card?
c2a1b151,Can you notify me if a product becomes available in my preferred color?
c2a1b151,What should I do if the product I want is out of stock?
c2a1b151,How can I find out when a product in my preferred color will be available again?
c2a1b151,Can I sign up for alerts when a product in my preferred color is back in stock?
c2a1b151,What happens if the product I want is not available in my preferred color?
6311fa20,Can I order a product that is listed as 'coming soon' but not available for pre-order?
6311fa20,What should I do if a product I want is listed as 'coming soon' but not available for pre-order?
6311fa20,Is it possible to purchase a product that is listed as 'coming soon' but not available for pre-order?
6311fa20,How can I buy a product that is listed as 'coming soon' but not available for pre-order?
6311fa20,What happens if I try to order a product that is listed as 'coming soon' but not available for pre-order?
dc347b46,Can I return a product that I bought during a promotional sale?
dc347b46,"If I bought a product on promotion and want to return it, will I get a full refund?"
dc347b46,Are returns allowed for items purchased during special promotions?
dc347b46,What is the return policy for products bought during promotional events?
dc347b46,Will I receive the promotion price back if I return an item bought on sale?
